{
  "metadata": {
    "schema_version": "1",
    "artifact_id": "runtime-profile:adaptive-step-within-tolerance",
    "revision": "1",
    "spec_version": "0.7.2",
    "content_hash": {
      "scope": "artifact-content",
      "status": "unresolved",
      "reason": "Generic artifact canonical bytes and digest algorithm are not selected pre-v0.8."
    },
    "provenance": {
      "source_kind": "reference",
      "source_id": "reference/runtime-time.md",
      "source_revision": "v0.7"
    },
    "compatibility": {
      "domain": "RuntimeProfile",
      "contract_revision": "1",
      "declarations": {
        "scheduler": "scheduler:adaptive@1",
        "integrators": ["integrator:reference@1"],
        "replay": "replay:within-tolerance@1",
        "temporal_tolerance": "tolerance:adaptive@1"
      }
    }
  },
  "scheduler": {
    "id": "scheduler:adaptive",
    "revision": "1",
    "compatibility": {
      "domain": "SchedulerPolicy",
      "contract_revision": "1",
      "declarations": {"policy": "AdaptiveStep"}
    },
    "contract": {
      "kind": "AdaptiveStep",
      "min_dt": {"semantic_type": "Time", "dimension": {"kg": 0, "m": 0, "s": 1, "A": 0, "K": 0, "mol": 0, "cd": 0}, "value": 1, "unit": "ms"},
      "max_dt": {"semantic_type": "Time", "dimension": {"kg": 0, "m": 0, "s": 1, "A": 0, "K": 0, "mol": 0, "cd": 0}, "value": 20, "unit": "ms"},
      "error_policy": {"relative": 1e-6}
    }
  },
  "integrators": [
    {
      "id": "integrator:reference",
      "revision": "1",
      "compatibility": {
        "domain": "IntegratorContract",
        "contract_revision": "1",
        "declarations": {"supported_processes": ["ReactionExtent"]}
      },
      "contract": {
        "supported_processes": ["ReactionExtent"],
        "deterministic_profile": "DeterministicWithinTolerance",
        "local_error_policy": {"relative": 1e-6},
        "global_error_policy": {"relative": 1e-5}
      }
    }
  ],
  "replay": {
    "id": "replay:within-tolerance",
    "revision": "1",
    "compatibility": {
      "domain": "ReplayProfile",
      "contract_revision": "1",
      "declarations": {"mode": "DeterministicWithinTolerance"}
    },
    "contract": {
      "mode": "DeterministicWithinTolerance",
      "deterministic_order_policy": "stable-source-sequence"
    }
  },
  "temporal_tolerance": {
    "id": "tolerance:adaptive",
    "revision": "1",
    "compatibility": {
      "domain": "TemporalTolerance",
      "contract_revision": "1",
      "declarations": {"units": "SI"}
    },
    "contract": {
      "event_time_error": {"semantic_type": "Time", "dimension": {"kg": 0, "m": 0, "s": 1, "A": 0, "K": 0, "mol": 0, "cd": 0}, "value": 500, "unit": "us"},
      "synchronization_error": {"semantic_type": "Time", "dimension": {"kg": 0, "m": 0, "s": 1, "A": 0, "K": 0, "mol": 0, "cd": 0}, "value": 1, "unit": "ms"}
    }
  }
}
