{
  "metadata":{"schema_version":"1","artifact_id":"runtime-profile:reference-fixture","revision":"1","spec_version":"0.7.2","content_hash":{"scope":"artifact-content","status":"unresolved","reason":"Generic artifact canonical bytes and digest algorithm are not selected pre-v0.8."},"provenance":{"source_kind":"reference","source_id":"reference/runtime-time.md","source_revision":"v0.7"},"compatibility":{"domain":"RuntimeProfile","contract_revision":"1","declarations":{"scheduler":"scheduler:hybrid@1","integrators":["integrator:reference@1"],"replay":"replay:strict@1","temporal_tolerance":"tolerance:default@1"}}},
  "scheduler":{"id":"scheduler:hybrid","revision":"1","compatibility":{"domain":"SchedulerPolicy","contract_revision":"1","declarations":{"policy":"Hybrid"}},"contract":{"kind":"Hybrid","baseline_policy":{"kind":"FixedStep","dt":{"semantic_type":"Time","dimension":{"kg":0,"m":0,"s":1,"A":0,"K":0,"mol":0,"cd":0},"value":10,"unit":"ms"}},"split_on_events":true,"microstep_budget":1024,"controller_timing":{"sample_period":{"semantic_type":"Time","dimension":{"kg":0,"m":0,"s":1,"A":0,"K":0,"mol":0,"cd":0},"value":20,"unit":"ms"},"max_jitter":{"semantic_type":"Time","dimension":{"kg":0,"m":0,"s":1,"A":0,"K":0,"mol":0,"cd":0},"value":1,"unit":"ms"},"actuation_latency_bound":{"semantic_type":"Time","dimension":{"kg":0,"m":0,"s":1,"A":0,"K":0,"mol":0,"cd":0},"value":5,"unit":"ms"}}}},
  "integrators":[{"id":"integrator:reference","revision":"1","compatibility":{"domain":"IntegratorContract","contract_revision":"1","declarations":{"supported_processes":["ReactionExtent"]}},"contract":{"supported_processes":["ReactionExtent"],"deterministic_profile":"DeterministicWithinTolerance","local_error_policy":{"relative":1e-6}}}],
  "replay":{"id":"replay:strict","revision":"1","compatibility":{"domain":"ReplayProfile","contract_revision":"1","declarations":{"mode":"StrictDeterministic"}},"contract":{"mode":"StrictDeterministic","deterministic_order_policy":"stable-source-sequence"}},
  "temporal_tolerance":{"id":"tolerance:default","revision":"1","compatibility":{"domain":"TemporalTolerance","contract_revision":"1","declarations":{"units":"SI"}},"contract":{"event_time_error":{"semantic_type":"Time","dimension":{"kg":0,"m":0,"s":1,"A":0,"K":0,"mol":0,"cd":0},"value":1,"unit":"ms"},"dispatch_latency_bound":{"semantic_type":"Time","dimension":{"kg":0,"m":0,"s":1,"A":0,"K":0,"mol":0,"cd":0},"value":5,"unit":"ms"}}}
}
