{
  "metadata": {
    "schema_version": "1",
    "artifact_id": "runtime-profile:event-driven-diagnostic",
    "revision": "1",
    "spec_version": "0.7.2",
    "content_hash": {
      "scope": "artifact-content",
      "status": "unresolved",
      "reason": "Generic artifact canonical bytes and digest algorithm are not selected pre-v0.8."
    },
    "provenance": {
      "source_kind": "reference",
      "source_id": "reference/runtime-time.md",
      "source_revision": "v0.7"
    },
    "compatibility": {
      "domain": "RuntimeProfile",
      "contract_revision": "1",
      "declarations": {
        "scheduler": "scheduler:event-driven@1",
        "integrators": ["integrator:diagnostic@1"],
        "replay": "replay:diagnostic@1",
        "temporal_tolerance": "tolerance:event-driven@1"
      }
    }
  },
  "scheduler": {
    "id": "scheduler:event-driven",
    "revision": "1",
    "compatibility": {
      "domain": "SchedulerPolicy",
      "contract_revision": "1",
      "declarations": {"policy": "EventDriven"}
    },
    "contract": {
      "kind": "EventDriven",
      "controller_timing": {
        "sample_period": {"semantic_type": "Time", "dimension": {"kg": 0, "m": 0, "s": 1, "A": 0, "K": 0, "mol": 0, "cd": 0}, "value": 10, "unit": "ms"},
        "max_jitter": {"semantic_type": "Time", "dimension": {"kg": 0, "m": 0, "s": 1, "A": 0, "K": 0, "mol": 0, "cd": 0}, "value": 1, "unit": "ms"},
        "actuation_latency_bound": {"semantic_type": "Time", "dimension": {"kg": 0, "m": 0, "s": 1, "A": 0, "K": 0, "mol": 0, "cd": 0}, "value": 5, "unit": "ms"},
        "required_phase_relation": "Control"
      }
    }
  },
  "integrators": [
    {
      "id": "integrator:diagnostic",
      "revision": "1",
      "compatibility": {
        "domain": "IntegratorContract",
        "contract_revision": "1",
        "declarations": {"supported_processes": ["ReactionExtent"]}
      },
      "contract": {
        "supported_processes": ["ReactionExtent"],
        "deterministic_profile": "DiagnosticBestEffort",
        "local_error_policy": {"absolute": 1e-8}
      }
    }
  ],
  "replay": {
    "id": "replay:diagnostic",
    "revision": "1",
    "compatibility": {
      "domain": "ReplayProfile",
      "contract_revision": "1",
      "declarations": {"mode": "DiagnosticBestEffort"}
    },
    "contract": {"mode": "DiagnosticBestEffort"}
  },
  "temporal_tolerance": {
    "id": "tolerance:event-driven",
    "revision": "1",
    "compatibility": {
      "domain": "TemporalTolerance",
      "contract_revision": "1",
      "declarations": {"units": "SI"}
    },
    "contract": {
      "controller_jitter": {"semantic_type": "Time", "dimension": {"kg": 0, "m": 0, "s": 1, "A": 0, "K": 0, "mol": 0, "cd": 0}, "value": 1, "unit": "ms"}
    }
  }
}
